{
  "release_name": "detection-dashboard-v1",
  "scope_key": "global",
  "schema_id": "configuration_manifest_v1",
  "schema_version": 1,
  "created_at": "2026-09-07T00:00:00+00:00",
  "components": {
    "detection": {
      "canonicalization_version": "canonicalization_v1",
      "score_formula_version": "attention_v1",
      "shortlist": {
        "policy_version": "shortlist_v1",
        "minimum_score": 0.6,
        "minimum_reliability": 0.7,
        "max_selected_6h": 2,
        "max_selected_24h": 6,
        "deferred_fresh_hours": 48,
        "cooldown_days": 3,
        "material_score_delta": 0.15
      },
      "sources": [
        {
          "stable_id": "nasa_recently_published_rss_v1",
          "source_kind": "publisher_feed_collector_v1",
          "adapter_version": "publisher_feed_adapter_v1",
          "provider_name": "NASA",
          "endpoint_url": "https://www.nasa.gov/feed/",
          "delivery_format": "rss",
          "coverage_note": "NASA recently published web content.",
          "enabled": true,
          "cadence_seconds": 900,
          "availability_seconds": 900,
          "trust_weight": 1.0,
          "independence_group": "nasa",
          "language_scope": "en",
          "region_scope": null,
          "quota_limit": null,
          "secret_ref": null,
          "allowed_redirect_hosts": ["nasa.gov", "www.nasa.gov"],
          "options": {"max_items": 100}
        },
        {
          "stable_id": "wikimedia_enwiki_daily_v1",
          "source_kind": "wikimedia_enwiki_pageviews_v1",
          "adapter_version": "wikimedia_pageviews_adapter_v1",
          "provider_name": "Wikimedia",
          "endpoint_url": "https://wikimedia.org/api/rest_v1/metrics/pageviews/top/en.wikipedia.org/all-access",
          "delivery_format": "json",
          "coverage_note": "English Wikipedia completed daily Top Pageviews report.",
          "enabled": true,
          "cadence_seconds": 86400,
          "availability_seconds": 86400,
          "trust_weight": 1.0,
          "independence_group": "wikimedia",
          "language_scope": "en",
          "region_scope": "global",
          "quota_limit": null,
          "secret_ref": null,
          "allowed_redirect_hosts": ["wikimedia.org"],
          "options": {
            "max_items": 1000,
            "project": "en.wikipedia.org",
            "access": "all-access",
            "agent": "all-agents"
          }
        },
        {
          "stable_id": "youtube_us_most_popular_v1",
          "source_kind": "youtube_most_popular_v1",
          "adapter_version": "youtube_most_popular_adapter_v1",
          "provider_name": "YouTube",
          "endpoint_url": "https://www.googleapis.com/youtube/v3/videos",
          "delivery_format": "json",
          "coverage_note": "United States mostPopular chart across all categories.",
          "enabled": true,
          "cadence_seconds": 1800,
          "availability_seconds": 1800,
          "trust_weight": 1.0,
          "independence_group": "youtube",
          "language_scope": null,
          "region_scope": "US",
          "quota_limit": 1000,
          "secret_ref": "YOUTUBE_API_KEY",
          "allowed_redirect_hosts": ["www.googleapis.com"],
          "options": {
            "max_items": 50,
            "region_code": "US",
            "parts": ["snippet", "statistics"]
          }
        },
        {
          "stable_id": "hacker_news_top_stories_v1",
          "source_kind": "hacker_news_top_stories_v1",
          "adapter_version": "hacker_news_top_stories_adapter_v1",
          "provider_name": "Hacker News",
          "endpoint_url": "https://hacker-news.firebaseio.com/v0",
          "delivery_format": "json",
          "coverage_note": "First 100 positions of the Hacker News Top Stories list.",
          "enabled": true,
          "cadence_seconds": 1800,
          "availability_seconds": 1800,
          "trust_weight": 1.0,
          "independence_group": "hacker_news",
          "language_scope": "en",
          "region_scope": "global",
          "quota_limit": null,
          "secret_ref": null,
          "allowed_redirect_hosts": ["hacker-news.firebaseio.com"],
          "options": {"max_items": 100}
        }
      ],
      "cluster_aliases": []
    }
  }
}
